display_name,type,lat,lon,alamat,zip,bank,country,provinsi,kota
"HSBC, Jalan Hayam Wuruk, RW 08, Maphar, Taman Sari, Jakarta Barat, Daerah Khusus Ibukota Jakarta, 11130, Indonesia",bank,-6.1526911,106.8178432,Jalan Hayam Wuruk,11130,HSBC,Indonesia,Daerah Khusus Ibukota Jakarta,Jakarta Barat
"HSBC, Jalan Pluit Kencana, RW 06, Pluit, Penjaringan, Jakarta Utara, Daerah Khusus Ibukota Jakarta, 14440, Indonesia",bank,-6.1196465,106.7883982,Jalan Pluit Kencana,14440,HSBC,Indonesia,Daerah Khusus Ibukota Jakarta,Jakarta Utara
"HSBC, Jalan Tanah Sereal VII, RW 13, Tanah Sereal, Tambora, Jakarta Barat, Daerah Khusus Ibukota Jakarta, 11270, Indonesia",bank,-6.1578921,106.8084366,Jalan Tanah Sereal VII,11270,HSBC,Indonesia,Daerah Khusus Ibukota Jakarta,Jakarta Barat
"HSBC, Jalan Boulevard Barat, RW 07, Kelapa Gading Barat, Kelapa Gading, Jakarta Utara, Daerah Khusus Ibukota Jakarta, Jawa, 14240, Indonesia",bank,-6.1576188,106.9010429,Jalan Boulevard Barat,14240,HSBC,Indonesia,Daerah Khusus Ibukota Jakarta,Jakarta Utara
"HSBC, Jalan Mayor Jenderal Jonosewojo, RW 02, Pradahkali Kendal, Dukuh Pakis, Surabaya, Jawa Timur, 60123, Indonesia",bank,-7.2875943,112.6790157,Jalan Mayor Jenderal Jonosewojo,60123,HSBC,Indonesia,Jawa Timur,Surabaya
"HSBC, Jalan Manyar Kertoarjo VI, RW 11, Mojo, Gubeng, Surabaya, Jawa Timur, 60116, Indonesia",bank,-7.27959815,112.76712465,Jalan Manyar Kertoarjo VI,60116,HSBC,Indonesia,Jawa Timur,Surabaya
"HSBC, Jalan Sukajadi, Gegerkalong, Sukajadi, Bandung, Jawa Barat, 40153, Indonesia",bank,-6.8783802,107.5964898,Jalan Sukajadi,40153,HSBC,Indonesia,Jawa Barat,Bandung
"HSBC, Jalan Insinyur Haji Juanda, Lebak Gede, Coblong, Bandung, Jawa Barat, Jawa, 40132, Indonesia",bank,-6.8971997,107.61329506005389,Jalan Insinyur Haji Juanda,40132,HSBC,Indonesia,Jawa Barat,Bandung
"HSBC, Jalan Diponegoro, Little India, Petisah, Medan Petisah, Kota Medan, Sumatera Utara, 20151, Indonesia",bank,3.5848422500000003,98.67325322305709,Jalan Diponegoro,20151,HSBC,Indonesia,Sumatera Utara,Kota Medan
"HSBC, Jalan Puri Kencana, RW 07, Kembangan Selatan, Kembangan, Jakarta Barat, Daerah Khusus Ibukota Jakarta, 11610, Indonesia",bank,-6.190703,106.7449258,Jalan Puri Kencana,11610,HSBC,Indonesia,Daerah Khusus Ibukota Jakarta,Jakarta Barat
"HSBC, Jalan Hang Lekir, RW 06, Gunung, Kebayoran Baru, Jakarta Selatan, Daerah Khusus Ibukota Jakarta, 12180, Indonesia",bank,-6.2306014,106.7955841,Jalan Hang Lekir,12180,HSBC,Indonesia,Daerah Khusus Ibukota Jakarta,Jakarta Selatan
"HSBC, Jalan Griya Utama, RW 20, Sunter Agung, Tanjung Priok, Jakarta Utara, Daerah Khusus Ibukota Jakarta, 14350, Indonesia",bank,-6.1406635,106.856067,Jalan Griya Utama,14350,HSBC,Indonesia,Daerah Khusus Ibukota Jakarta,Jakarta Utara
"HSBC, Jalan Profesor Dokter Satrio, RW 04, Karet Kuningan, Setiabudi, Jakarta Selatan, Daerah Khusus Ibukota Jakarta, Jawa, 12940, Indonesia",bank,-6.2239766,106.8265577,Jalan Profesor Dokter Satrio,12940,HSBC,Indonesia,Daerah Khusus Ibukota Jakarta,Jakarta Selatan
"HSBC, 29-31, Jalan Jenderal Sudirman, RW 01, Karet, Setiabudi, Jakarta Selatan, Daerah Khusus Ibukota Jakarta, Jawa, 12920, Indonesia",bank,-6.2152554,106.8203717,Jalan Jenderal Sudirman,12920,HSBC,Indonesia,Daerah Khusus Ibukota Jakarta,Jakarta Selatan
"HSBC, Jalan Mandala Raya, RW 01, Tomang, Grogol Petamburan, Jakarta Barat, Daerah Khusus Ibukota Jakarta, 11440, Indonesia",bank,-6.1770687,106.79959,Jalan Mandala Raya,11440,HSBC,Indonesia,Daerah Khusus Ibukota Jakarta,Jakarta Barat
"HSBC, Jalan Panjang Raya, RW 08, Kedoya Utara, Kebon Jeruk, Jakarta Barat, Daerah Khusus Ibukota Jakarta, 11520, Indonesia",bank,-6.1650788,106.7633921,Jalan Panjang Raya,11520,HSBC,Indonesia,Daerah Khusus Ibukota Jakarta,Jakarta Barat
"HSBC, 1, Jalan Jenderal Sudirman, RW 09, Karet Tengsin, Tanah Abang, Jakarta Pusat, Daerah Khusus Ibukota Jakarta, Jawa, 10220, Indonesia",bank,-6.2037524,106.8205776,Jalan Jenderal Sudirman,10220,HSBC,Indonesia,Daerah Khusus Ibukota Jakarta,Jakarta Pusat
"HSBC, Jalan Diponegoro, Little India, Petisah, Medan Petisah, Kota Medan, Sumatera Utara, 20151, Indonesia",bank,3.5848422500000003,98.67325322305709,Jalan Diponegoro,20151,HSBC,Indonesia,Sumatera Utara,Kota Medan
"HSBC, 9, Jalan Perintis Kemerdekaan, Gang Buntu, Pandau, Sidorame Barat I, Kota Medan, Sumatera Utara, Sumatera, 20234, Indonesia",bank,3.5977058,98.6795258,Jalan Perintis Kemerdekaan,20234,HSBC,Indonesia,Sumatera Utara,Kota Medan
"HSBC, Jalan Dokter Saharjo, RW 01, Tebet Barat, Tebet, Jakarta Selatan, Daerah Khusus Ibukota Jakarta, 12860, Indonesia",bank,-6.2255957,106.8478209,Jalan Dokter Saharjo,12860,HSBC,Indonesia,Daerah Khusus Ibukota Jakarta,Jakarta Selatan
"HSBC, Jalan Mangga Dua Raya, RW 11, Mangga Dua Selatan, Sawah Besar, Jakarta Pusat, Daerah Khusus Ibukota Jakarta, 14420, Indonesia",bank,-6.1365318,106.8289528,Jalan Mangga Dua Raya,14420,HSBC,Indonesia,Daerah Khusus Ibukota Jakarta,Jakarta Pusat
"HSBC, Jalan Pluit Karang Indah Timur, RW 12, Pluit, Penjaringan, Jakarta Utara, Daerah Khusus Ibukota Jakarta, 14440, Indonesia",bank,-6.1177909,106.7834094,Jalan Pluit Karang Indah Timur,14440,HSBC,Indonesia,Daerah Khusus Ibukota Jakarta,Jakarta Utara
"HSBC, Jalan Sampit V, RW 06, Kramat Pela, Kebayoran Baru, Jakarta Selatan, Daerah Khusus Ibukota Jakarta, 12130, Indonesia",bank,-6.24553255,106.79575718193405,Jalan Sampit V,12130,HSBC,Indonesia,Daerah Khusus Ibukota Jakarta,Jakarta Selatan
"HSBC, Jalan Basuki Rahmat, Kemuning, Palembang, Sumatera Selatan, 30129, Indonesia",bank,-2.9580587,104.7419756,Jalan Basuki Rahmat,30129,HSBC,Indonesia,Sumatera Selatan,Palembang
"HSBC, 8, Jalan Glugur By Pass, Petisah Tengah, Petisah, Medan Petisah, Kota Medan, Sumatera Utara, 20112, Indonesia",bank,3.5908003,98.668648,Jalan Glugur By Pass,20112,HSBC,Indonesia,Sumatera Utara,Kota Medan
"HSBC, Jalan Gajah Mada, RW 05, Pekunden, Semarang Tengah, Semarang, Jawa Tengah, Jawa, 50241, Indonesia",bank,-6.9879523,110.4224816,Jalan Gajah Mada,50241,HSBC,Indonesia,Jawa Tengah,Semarang
"HSBC, Jalan Jenderal Achmad Yani, Sungai Baru, Banjarmasin Tengah, Banjarmasin, Kalimantan Selatan, 70233, Indonesia",bank,-3.3216583,114.5970974,Jalan Jenderal Achmad Yani,70233,HSBC,Indonesia,Kalimantan Selatan,Banjarmasin
"HSBC, Jl.S.Parman, Mukakuning, Batam, Kepulauan Riau, 29433, Indonesia",bank,1.0692703,104.0252066,Mukakuning,29433,HSBC,Indonesia,Kepulauan Riau,Batam
"HSBC, Jalan Ikan Bawal, Bumi Waras, Bandar Lampung, Lampung, 34223, Indonesia",bank,-5.4482008,105.2661985,Jalan Ikan Bawal,34223,HSBC,Indonesia,Lampung,Bandar Lampung
"HSBC, Jalan Pahlawan Seribu, Lengkong Gudang, BSD City, Serpong, Tangerang Selatan, Banten, Jawa, 15320, Indonesia",bank,-6.2870098,106.6657069,Jalan Pahlawan Seribu,15320,HSBC,Indonesia,Banten,Tangerang Selatan
"HSBC, Bintaro Utama 3A, Bintaro Jaya, Pondok Karya, Pondok Aren, Tangerang Selatan, Banten, 15225, Indonesia",bank,-6.2696319,106.7390218,Bintaro Utama 3A,15225,HSBC,Indonesia,Banten,Tangerang Selatan
"HSBC, Jalan Raya Margonda, Depok, Beji, Bogor, Jawa Barat, Jawa, 16235, Indonesia",bank,-6.3709118,106.8331357,Jalan Raya Margonda,16235,HSBC,Indonesia,Jawa Barat,Bogor
"HSBC, Jalan P.B. Sudirman, Dauh Puri Klod, Panjer, Denpasar Selatan, Bali, 80210, Indonesia",bank,-8.6745879,115.2181539,Jalan P.B. Sudirman,80210,HSBC,Indonesia,Bali,Denpasar Selatan
"Bank HSBC, Jalan Mangga Dua Raya, RW 12, Mangga Dua Selatan, Sawah Besar, Jakarta Pusat, Daerah Khusus Ibukota Jakarta, 14420, Indonesia",bank,-6.1363439,106.8270609,Jalan Mangga Dua Raya,14420,BANK HSBC,Indonesia,Daerah Khusus Ibukota Jakarta,Jakarta Pusat
"Graha HSBC Surabaya, Jalan Jenderal Basuki Rachmat, RW 01, Tegalsari, Surabaya, Jawa Timur, 68485, Indonesia",bank,-7.2669477,112.74069025409091,Jalan Jenderal Basuki Rachmat,68485,GRAHA HSBC SURABAYA,Indonesia,Jawa Timur,Surabaya
